[
  {
    "doc_id": "statute_cpa2019_section_210",
    "source_type": "statute",
    "title": "Section 2(10) - Definition of Defect",
    "text": "Defect means any fault, imperfection or shortcoming in the quality, quantity, potency, purity or standard which is required to be maintained by or under any law for the time being in force or under any contract, express or implied or as is claimed by the trader in any manner whatsoever in relation to any goods or product.",
    "tags": [
      "consumer protection act 2019",
      "statute",
      "Section 2(10)",
      "Definition of Defect",
      "Defines actionable faults in physical goods and products."
    ],
    "jurisdiction": "India",
    "authority_level": 1,
    "verified": true,
    "source_url": "https://www.indiacode.nic.in/handle/123456789/15256",
    "year": 2019,
    "metadata": {
      "act_or_document_name": "Consumer Protection Act, 2019",
      "section_or_rule": "Section 2(10)",
      "legal_purpose": "Defines actionable faults in physical goods and products."
    }
  },
  {
    "doc_id": "statute_cpa2019_section_211",
    "source_type": "statute",
    "title": "Section 2(11) - Definition of Deficiency",
    "text": "Deficiency means any fault, imperfection, shortcoming or inadequacy in the quality, nature and manner of performance which is required to be maintained by or under any law for the time being in force or has been undertaken to be performed by a person in pursuance of a contract or otherwise in relation to any service.",
    "tags": [
      "consumer protection act 2019",
      "statute",
      "Section 2(11)",
      "Definition of Deficiency",
      "Defines actionable shortcomings in professional, commercial, or public services."
    ],
    "jurisdiction": "India",
    "authority_level": 1,
    "verified": true,
    "source_url": "https://www.indiacode.nic.in/handle/123456789/15256",
    "year": 2019,
    "metadata": {
      "act_or_document_name": "Consumer Protection Act, 2019",
      "section_or_rule": "Section 2(11)",
      "legal_purpose": "Defines actionable shortcomings in professional, commercial, or public services."
    }
  },
  {
    "doc_id": "statute_cpa2019_section_228",
    "source_type": "statute",
    "title": "Section 2(28) - Definition of Misleading Advertisement",
    "text": "Misleading advertisement in relation to any product or service means an advertisement, which falsely describes such product or service, or gives a false guarantee to, or is likely to mislead the consumers as to the nature, substance, quantity or quality of such product or service.",
    "tags": [
      "consumer protection act 2019",
      "statute",
      "Section 2(28)",
      "Definition of Misleading Advertisement",
      "Prohibits deceptive sales marketing, false guarantees, or scientific misrepresentations."
    ],
    "jurisdiction": "India",
    "authority_level": 1,
    "verified": true,
    "source_url": "https://www.indiacode.nic.in/handle/123456789/15256",
    "year": 2019,
    "metadata": {
      "act_or_document_name": "Consumer Protection Act, 2019",
      "section_or_rule": "Section 2(28)",
      "legal_purpose": "Prohibits deceptive sales marketing, false guarantees, or scientific misrepresentations."
    }
  },
  {
    "doc_id": "statute_cpa2019_section_247",
    "source_type": "statute",
    "title": "Section 2(47) - Definition of Unfair Trade Practice",
    "text": "Unfair trade practice means a trade practice which, for the purpose of promoting the sale, use or supply of any goods or for the provision of any service, adopts any unfair method or unfair or deceptive practice including making false or misleading representation, refusal to refund paid consideration within 30 days, or disclosing confidential personal information.",
    "tags": [
      "consumer protection act 2019",
      "statute",
      "Section 2(47)",
      "Definition of Unfair Trade Practice",
      "Establishes comprehensive prohibition against deceptive commercial conduct and mandatory 30-day refund rules."
    ],
    "jurisdiction": "India",
    "authority_level": 1,
    "verified": true,
    "source_url": "https://www.indiacode.nic.in/handle/123456789/15256",
    "year": 2019,
    "metadata": {
      "act_or_document_name": "Consumer Protection Act, 2019",
      "section_or_rule": "Section 2(47)",
      "legal_purpose": "Establishes comprehensive prohibition against deceptive commercial conduct and mandatory 30-day refund rules."
    }
  },
  {
    "doc_id": "statute_cpa2019_section_39",
    "source_type": "statute",
    "title": "Section 39 - Findings of District Commission and Statutory Orders",
    "text": "Where the District Commission is satisfied that the goods complained against suffer from any of the defects specified in the complaint or that any of the allegations contained in the complaint about services or unfair trade practices are proved, it shall issue an order directing the opposite party to remove defects, replace goods with defect-free items, return the price paid along with interest, or pay compensation.",
    "tags": [
      "consumer protection act 2019",
      "statute",
      "Section 39",
      "Findings of District Commission and Statutory Orders",
      "Empowers District Consumer Commissions to issue binding statutory orders for refund, replacement, or damages."
    ],
    "jurisdiction": "India",
    "authority_level": 1,
    "verified": true,
    "source_url": "https://www.indiacode.nic.in/handle/123456789/15256",
    "year": 2019,
    "metadata": {
      "act_or_document_name": "Consumer Protection Act, 2019",
      "section_or_rule": "Section 39",
      "legal_purpose": "Empowers District Consumer Commissions to issue binding statutory orders for refund, replacement, or damages."
    }
  },
  {
    "doc_id": "statute_cpa2019_section_83_84",
    "source_type": "statute",
    "title": "Section 83 & 84 - Product Liability Action and Manufacturer Liability",
    "text": "A product liability action may be brought by a complainant against a product manufacturer, product service provider, or product seller for any harm caused on account of a defective product. A product manufacturer shall be liable if the product contains a manufacturing defect, design defect, or non-conformance with express warranty.",
    "tags": [
      "consumer protection act 2019",
      "statute",
      "Section 83 & 84",
      "Product Liability Action and Manufacturer Liability",
      "Establishes strict product liability claims against manufacturers and distributors for physical or property harm."
    ],
    "jurisdiction": "India",
    "authority_level": 1,
    "verified": true,
    "source_url": "https://www.indiacode.nic.in/handle/123456789/15256",
    "year": 2019,
    "metadata": {
      "act_or_document_name": "Consumer Protection Act, 2019",
      "section_or_rule": "Section 83 & 84",
      "legal_purpose": "Establishes strict product liability claims against manufacturers and distributors for physical or property harm."
    }
  },
  {
    "doc_id": "statute_cpa2019_section_87",
    "source_type": "statute",
    "title": "Section 87 - Exceptions to Product Liability Action",
    "text": "A product liability action cannot be brought against the product seller or manufacturer if at the time of harm the product was misused, altered, or modified by the consumer, or if the danger was obvious or commonly known.",
    "tags": [
      "consumer protection act 2019",
      "statute",
      "Section 87",
      "Exceptions to Product Liability Action",
      "Provides statutory defenses for manufacturers and sellers where consumer misuse or obvious danger occurred."
    ],
    "jurisdiction": "India",
    "authority_level": 1,
    "verified": true,
    "source_url": "https://www.indiacode.nic.in/handle/123456789/15256",
    "year": 2019,
    "metadata": {
      "act_or_document_name": "Consumer Protection Act, 2019",
      "section_or_rule": "Section 87",
      "legal_purpose": "Provides statutory defenses for manufacturers and sellers where consumer misuse or obvious danger occurred."
    }
  }
]